title,link,category,Full Content,Date
Moedas apela à responsabilidade do PS para viabilizar moção de confiança,https://www.jn.pt/1440063719/moedas-apela-a-responsabilidade-do-ps-para-viabilizar-mocao-de-confianca/,Crise política,"O presidente da Câmara de Lisboa, Carlos Moedas (PSD), disse esta sexta-feira que o Governo ""foi obrigado” a apresentar uma moção de confiança e defendeu que “o país não quer ir para eleições”, apelando à responsabilidade política do PS.
“O Governo [de PSD/CDS-PP, que governa sem maioria absoluta] foi obrigado a lançar esta moção de confiança. Há uma responsabilidade aqui de todos, obviamente, mas há uma responsabilidade do maior partido da oposição [o PS]. Os portugueses querem estabilidade, querem continuar a ter um Governo e esse Governo deve continuar em funções”, afirmou Carlos Moedas, que é também membro do Conselho Nacional do PSD e do Conselho de Estado.
O autarca de Lisboa falava aos jornalistas após uma reunião do Conselho Municipal de Segurança, a primeira deste ano, que decorreu nos Paços do Concelho, com a presença dos comandantes do Comando Metropolitano de Lisboa da Polícia de Segurança Pública (PSP) e da Polícia Municipal de Lisboa, Luís Elias e José Carvalho Figueira, respetivamente.
Questionado se o previsível cenário de eleições antecipadas pode ser evitado com a aceitação da proposta do PS de uma comissão parlamentar de inquérito sobre a situação do primeiro-ministro relativa à empresa Spinumviva, o presidente da Câmara de Lisboa respondeu que “o país tem de continuar a funcionar” e que os autarcas estão preocupados com a situação política nacional, porque estão “muito próximos da população e aquilo que a população diz é que não quer eleições”.
“As pessoas, obviamente, estão chocadas com o momento que estamos a viver no país em termos políticos. […] eu estou chocado com esta possibilidade de voltar a ter eleições. Não faz sentido nenhum para as pessoas”, declarou o social-democrata.
Repetindo, por várias vezes, que “o país não quer ir a eleições”, Carlos Moedas apelou à responsabilidade política do PS, como maior partido da oposição do Governo liderado por Luís Montenegro (PSD), considerando que os socialistas devem “refletir muito bem antes de tomar uma decisão sobre a moção de confiança”.
“Eu sei que estamos a viver um momento no país, estou consciente desse momento, mas o que preocupa as pessoas na rua é a vida de todos os dias, são estas situações de segurança que acontecem na cidade”, ressalvou o autarca do PSD, indicando que em Lisboa está “sempre a trabalhar nessa estabilidade”, uma vez que também governa sem maioria absoluta.
Na quarta-feira à noite, o Presidente da República, Marcelo Rebelo de Sousa, admitiu eleições antecipadas em maio, após o primeiro-ministro, Luís Montenegro (PSD), ter anunciado uma moção de confiança que tem chumbo prometido dos dois maiores partidos da oposição, PS e Chega, e que deverá ditar a queda do Governo na próxima semana.
A moção de confiança ao Governo de PSD/CDS-PP, que governa o país sem maioria absoluta, foi aprovada na quinta-feira em Conselho de Ministros, prevendo-se que seja debatida e votada na próxima terça-feira.
O voto de confiança foi avançado por Luís Montenegro no arranque do debate da moção de censura do PCP, que foi rejeitada com a abstenção do PS na Assembleia da República, e em que voltou a garantir que “não foi avençado” nem violou dever de exclusividade com a empresa que tinha com a família, a Spinumviva.
Se a moção de confiança for rejeitada na terça-feira no parlamento, o Presidente da República convocará de imediato os partidos ao Palácio de Belém, “se possível para o dia seguinte”, e o Conselho de Estado, “para dois dias depois"", admitindo eleições entre 11 ou 18 de maio.","<div class=""date""> 07 março, 2025 às 13:24 </div>"
"Gouveia e Melo: ""Precisamos de estabilidade governativa""",https://www.jn.pt/3379427304/gouveia-e-melo-pede-solucao-urgente-para-o-pais-precisamos-de-estabilidade-governativa/,Crise política,"O ex-chefe do Estado Maior da Armada Gouveia e Melo recusou, esta sexta-feira, comentar a crise política em Portugal, defendendo apenas que os atores políticos têm de encontrar uma solução ""de forma urgente"".
""A solução tem de aparecer, nós precisamos de credibilidade e estabilidade governativa, até para o nosso posicionamento internacional"", sublinhou, em declarações aos jornalistas, à margem de um congresso sobre gestão em saúde, na Alfândega do Porto.
""O importante é que os atores políticos decidam de forma urgente o que querem fazer"", acrescentou, recusando responder se considera possível evitar-se a realização de eleições antecipadas. ""De resto não faço comentários, não sou comentador"", sublinhou o almirante na reserva, que tem sido apontado como possível candidato às presidenciais.
Na quinta-feira, o candidato presidencial Luís Marques Mendes pediu ao presidente da República para fazer uma“última tentativa”junto do primeiro-ministro e do PS para evitar eleições, considerando-as indesejáveis face ao atual cenário internacional e à execução do PRR. Em declarações à Lusa, o antigo presidente do PSD afirmou que o “país está incrédulo com a ideia de ter eleições antecipadas”, não as deseja, nem compreende a sua utilidade, salientando que ele próprio partilha dessa apreensão.
“Por isso, gostava de fazer um apelo ao senhor presidente da República e o apelo é que possa fazer uma última tentativa, um último esforço, para evitar eleições, para garantir a estabilidade”, pediu.
A moção de confiança que o Governo vai apresentar ao Parlamento foi aprovada ontem, em Conselho de Ministros. O debate e votação do documento, que muito provavelmente resultará na queda do Executivo, estão agendados para a próxima terça-feira.
Na quarta-feira, durante o debate da moção de censura avançada pelo PCP - que foi chumbada sem surpresas - Luís Montenegro anunciou que o Governo ia avançar comuma moção de confiança, reconhecendo que a antecipação das eleições ""não é desejável"", mas será ""um mal necessário para evitar a degradação das instituições e a perda da estabilidade política"".","<div class=""date""> 07 março, 2025 às 11:58 </div>"
PCP defende que “única saída” da crise é dissolver parlamento e convocar eleições,https://www.jn.pt/4376373117/pcp-defende-que-unica-saida-da-crise-e-dissolver-parlamento-e-convocar-eleicoes/,Nacional,"O secretário-geral do PCP defendeu, esta quinta-feira, que a ""única saída"" da crise política é a dissolução do parlamento e a convocação de eleições antecipadas e acusou o PS de só divergir com o Governo em casos e não políticas.
""Verificada que seja a derrota deste Governo, afastadas que sejam as manobras para garantir a sua continuidade com outros rostos, confirmada que está a impossibilidade de, no quadro da atual composição da Assembleia da República, se encontrar a resposta necessária aos problemas do país, a clarificação da vida política nacional exige como única saída a dissolução da Assembleia e a convocação de eleições"", defendeu Paulo Raimundo no comício do 104.º aniversário do PCP, no Pavilhão Casal Vistoso, em Lisboa.
O secretário-geral do PCP defendeu que a questão atual ""não é saber como evitar uma crise política"", mas sim ""como se sai da crise governamental, da instabilidade política e, acima de tudo, como se sai da instabilidade da vida de milhões e milhões que cá trabalham e vivem"".
Defendendo que, ""para lá da gravidade de factos e acontecimentos deploráveis"" envolvendo o primeiro-ministro, a ""questão essencial é a da política do Governo"", Paulo Raimundo considerou que a prática deste executivo demonstrou que ""não está em condições de responder aos problemas nacionais"".
""A política e a prática do Governo o que exigem é que se interrompa o mais rápido possível a sua agenda de retrocesso, a sua agenda de degradação da vida de cada um de nós"", disse, sustentando que as ""eleições podem e devem constituir uma oportunidade para abrir caminho a uma outra política"".
Neste discurso, em que acusou Chega e IL de convergirem com o PSD/CDS ""em tudo o que serve o grande capital"", Paulo Raimundo focou também as suas críticas no PS, que acusou de se ter juntado ""uma vez mais à direita"" esta quarta-feira, ao votar contra a moção de censura do PCP ao Governo.
Para o dirigente comunista, as discordâncias do PS relativamente ao Governo ""limitam-se a casos, graves e inaceitáveis, mas que são apenas uma parte das razões que existem para censurar este Governo"".
""Uma opção que foi ficando patente nestes meses de vida do Governo PSD/CDS quando o PS recusou a moção de rejeição do PCP ao programa do Governo, quando recusou a comissão parlamentar de inquérito à ANA, quando viabilizou o Orçamento, apoiou a baixa do IRC aos grupos económicos, ou quando se juntou ao PSD e CDS na lei dos solos"", elencou.
Numa alusão também ao PS, Paulo Raimundo disse que, ""ao contrário de outros que se afirmam da oposição, mas que, na hora H, estão lá sempre a pôr a mão por baixo do Governo"", o PCP optou por avançar com uma moção de segurança que, disse, ""constituiu-se como o elemento decisivo de clarificação da vida política"".
""Ficou claro, e desmentindo todos os que em coro procuraram diminuir o valor da nossa iniciativa (…), que a moção de censura do PCP obrigou o Governo a vir a jogo, a anunciar uma moção de confiança que, como se sabe, estava longe de estar decidida ou planeada"", disse, acrescentando que, sem a moção de censura do partido, ""o Governo teria tido no taticismo de outros as garantias de continuidade"".
Paulo Raimundo defendeu que eventuais eleições legislativas ""podem e devem constituir uma oportunidade para abrir caminho a uma outra política"", frisando que ""está na ação e luta dos trabalhadores e do povo"" a possibilidade de concretizar uma política alternativa ao dar ""mais força à CDU"".
""Avançamos com confiança e determinação para a batalha eleitoral"", assegurou, num discurso em que apelou à mobilização das centenas de militantes que o ouviam para tornar o PCP ""mais forte e mais influente"".
O secretário-geral do PCP defendeu que a paz e a segurança não dependem do aumento das despesas militares ou “na militarização da União Europeia”, mas de “mais diplomacia, mais diálogo e solução política dos conflitos”.
Paulo Raimundo abordou a situação internacional, dois dias depois de a presidente da Comissão Europeia, Ursula von der Leyen, ter anunciado um pacote de 800 mil milhões de euros para investimento em defesa.
O secretário-geral do PCP considerou que, “infelizmente, face à eventualidade do início de um processo de negociação, as potências imperialistas europeias insistem no prolongamento da guerra, contando com o poder instalado na Ucrânia para continuar a sacrificar os ucranianos como carne para canhão”.
“E lançam-se no aumento das despesas militares e na escalada armamentista, empurrando os povos da Europa para o abismo”, criticou.
Para Paulo Raimundo, “a deriva militarista e a obsessão pela guerra que impregna os centros de decisão da UE aí está sem fim à vista”.
“Agora, até esse dogma do défice dos seus limites, essa vaca sagrada invocada para impor empobrecimento e exploração que tão bem conhecemos no nosso país nos dizem que pode ser ignorado se resultar de mais despesas com armas e guerra”, referiu.
O secretário-geral do PCP considerou que, “para a saúde, educação, proteção social e habitação, pensões e salários” há sempre a desculpa de que não há recursos.
“Dizem-nos sempre que os orçamentos não aguentam. Mas para a guerra é à ‘tripa forra’ e o défice já não importa”, criticou, recebendo um forte aplauso das centenas de militantes que o ouviam no pavilhão.
Pedindo que se ponha fim à “loucura de confrontação e guerra”, Paulo Raimundo defendeu que “a paz e a segurança não estão no aumento das despesas militares, não estão na militarização da UE e na sua transformação num bloco belicista”.
“A paz e a segurança alcançam-se com mais diplomacia, mais diálogo e solução política dos conflitos e com mais respeito pelos princípios do direito internacional”, frisou.
O secretário-geral do PCP abordou ainda a postura recente do Presidente dos Estados Unidos, Donald Trump, sobre o conflito na Ucrânia, considerando que o seu “reposicionamento tático” não tem “nada a ver com paz e cooperação entre os povos”, mas visa antes garantir que Washington continua “a tentar impor os seus interesses e ditames ao mundo”.
“Uma reconfiguração estratégica que, apesar das dificuldades no plano interno e externo, procura que os Estados Unidos se centrem ainda mais na política de confrontação com a China”, disse.
Para o secretário-geral do PCP, “os desenvolvimentos da situação internacional, nomeadamente os decorrentes das medidas e posicionamentos da administração Trump, são expressão das principais tendências que estão a marcar a evolução do mundo”.
“Trump não é um acidente de percurso do sistema é, isso sim, um percurso e instrumento do capitalismo”, defendeu.
A nível nacional, Paulo Raimundo defendeu que o Governo deve agir de acordo com a Constituição da República, que estipula que “deve promover a paz e a cooperação, não o militarismo, a corrida aos armamentos e a guerra”.
“Convicto da sua razão, não recuando perante falsidades e deturpações, o PCP continua firme e corajosamente na defesa da paz. Aqui estamos empenhados no desarmamento geral, simultâneo e controlado, pela dissolução dos blocos político-militares e do estabelecimento de um sistema de segurança coletiva”, disse.","<div class=""date""> 07 março, 2025 às 00:30 </div>"
Montenegro promete voltar e acelera anúncios do Governo,https://www.jn.pt/7034841521/montenegro-promete-voltar-e-acelera-anuncios-do-governo/,exclusivoCrise política,"O Governo apressou-se a aprovar a moção de confiança que levará o país a eleições antecipadas , o “mal necessário” escolhido por Luís Montenegro, que promete ser novamente candidato nas legislativas, apostado numa “larga maioria”.
Aproveitará o tempo que lhe resta até à queda do Governo para acelerar anúncios, num clima que já cheira a campanha.","<div class=""date""> 06 março, 2025 às 22:45 </div>"
Queda do Governo pode adiar vários dossiês,https://www.jn.pt/8058048364/queda-do-governo-pode-adiar-varios-dossies/,exclusivoCrise política,"Vários processos podem cair ou ficar em suspenso com a queda do Governo, que ficará limitado a poderes de gestão até às eleições. Há decisões como a nomeação do governador do BdP, o futuro da TAP ou a criação de centros de saúde a passar para as mãos de um novo Executivo. No Parlamento, as comissões são afetadas.
","<div class=""date""> 06 março, 2025 às 20:32 </div>"
Quais são os próximos passos até haver um novo Governo?,https://www.jn.pt/7652941930/quais-sao-os-proximos-passos-ate-haver-um-novo-governo/,Explicador,"O atual Governo aprovou nesta quinta-feira uma moção de confiança que irá submeter à votação dos deputados da Assembleia da República na próxima terça-feira. Abre-se um novo ciclo político. Conheça os procedimentos:
1. Que votação seria necessária para que a moção de confiança fosse viabilizada?
Uma moção de confiança apresentada pelo Governo precisa de maioria simples, ao contrário da moção de censura, que apenas é aprovada com uma maioria absoluta dos deputados em efetividade de funções, ou seja, de 116.
2. O que acontece se for chumbada, tal como se prevê, após os maiores partidos da Oposição terem afirmado que votarão contra?
O presidente da Assembleia da República tem de comunicar ao chefe de Estado o chumbo da moção de confiança. O artigo 195.º da Constituição estabelece que “a não aprovação de uma moção de confiança” implica a demissão do Governo.
3. O que faz então o presidente?
Após ouvir os partidos e o Conselho de Estado, deverá anunciar eleições para maio, seguindo o mesmo critério que usou com António Costa, apesar de existir outro cenário possível para um presidente, que é indigitar um novo primeiro-ministro, sem necessidade de antecipar as legislativas.
4. Como fica a gestão do Executivo?
Após rejeição da moção de confiança, o Governo  fica em gestão, com poderes limitados, até novas legislativas e a posse de novo Executivo. Há dossiês que ficam pendurados, uma vez que não tem plenos poderes para determinadas decisões. No artigo 186 .º da Constituição, lê-se que, “antes da apreciação do seu programa pela Assembleia da República, ou após a sua demissão, o Governo limitar-se-á à prática dos atos estritamente necessários para assegurar a gestão dos negócios públicos”. De fora, ficarão, por exemplo, medidas estruturantes e nomeações de perfil elevado sem consenso entre os maiores partidos.
5. Quando poderemos ter um novo Governo?
Se dissolver o Parlamento, Marcelo terá de marcar eleições para um período entre os 55 e 60 dias a seguir ao decreto. Prometeu uma decisão rápida, após ouvir os partidos e o Conselho de Estado na próxima semana. E apontou as eleições para maio, a 11 ou 18. Desde as legislativas até à tomada de posse, costumam passar de três a cinco semanas.","<div class=""date""><span>06 março, 2025</span> às <span>19:04</span></div>"
É hora de cada um ter juízo,https://www.jn.pt/1308555039/e-hora-de-cada-um-ter-juizo/,Opinião,"
“É hora de cada um assumir as suas responsabilidades”. Esta é a frase que consta no final do comunicado do Conselho de Ministros que dá conta da aprovação da moção de confiança que o Governo vai submeter ao Parlamento na terça-feira.
A frase é infeliz. A hora de cada um ter assumido as suas responsabilidades, da esquerda à direita, passando pelo centro e demais tendências políticas, aconteceu no dia 10 de março de 2024. O dia em que os portugueses foram chamados às urnas após uma crise política com contornos cinematográficos, escândalos e uma série de demissões. O Governo, então de maioria absoluta, cai, e das eleições resulta um Parlamento mais fragmentado, com 50 lugares ocupados pela extrema-direita.
Era hora de todos terem assumido as suas responsabilidades e finalmente dar rumo ao país. Os problemas de sempre estavam por resolver. Passou um ano e os problemas de sempre, aqueles que afetam as pessoas do país real, continuam sem resolução. O estado da Saúde e da Educação, a resposta à crise da habitação, o crescimento económico que continua longe das carteiras da maioria dos portugueses.
Poucos acertaram na hora. Um primeiro-ministro que andou com os ponteiros atrasados, um líder da Oposição que mudou o fuso horário conforme as circunstâncias e outros que tiveram de correr atrás do prejuízo com problemas no seio dos seus próprios partidos.
As prováveis eleições de maio serão apenas uma espécie de referendo, um teste de idoneidade. Quais serão as diferenças dos programas eleitorais que os partidos vão apresentar relativamente ao sufrágio do ano passado? Muito poucas.
Os portugueses vão ser de novo chamados às urnas e também era preciso que lhes explicassem muito bem as razões da convocatória. E um pedido de desculpas nem era exagerado.","<div class=""date""><span>07 março, 2025</span> às <span>00:12</span></div>"
Leitão Amaro tapa a cara com folha e deixa à mostra notas para gestão de crise,https://www.jn.pt/3899901523/leitao-amaro-tapa-a-cara-com-folha-e-deixa-a-mostra-notas-para-gestao-de-crise/,Parlamento,"Rascunho que seria um conjunto de anotações sobre a ação do Governo para os próximos dias tem sete tópicos.
O momento aconteceu na quarta-feira,durante o debate da moção de censura, que acabou chumbada com as abstenções do PS e do Chega: a dado momento, o ministro da Presidência, António Leitão Amaro, deixou-se fotografar inadvertidamente com um rascunho onde constava a aparente estratégia de gestão de crise do executivo. Isto porque no verso do papel que usava para esconder a cara das câmaras com uma folha, para garantir alguma privacidade ao falar com Luís Montenegro, estava escrevinhado o plano de comunicação do Executivo para os próximos dias. A imagem foi captada pelo fotojornalista da agência Lusa Manuel de Almeida.
De acordo com o ""Observador"", a quem fontes do Governo confirmaram a veracidade do documento, é bastante possível que a estratégia tenha sofrido alterações e que estas sejam apenas notas preliminares, entretanto atualizadas. E, segundo o explicou fonte do Executivo ao ""Público"", o rascunho corresponde a um conjunto de anotações e não a um plano concreto de gestão da atual crise política.
No documento em causa, lê-se que ainda na quarta-feira, depois do debate da moção de censura, os ministros iriam às televisões - à semelhança do que aconteceu no sábado passado, quando, depois da declaração de Luís Montenegro ao país, cinco governantes estiveram nos cinco canais de notícias a responder a perguntas sobre a empresa familiar do primeiro-ministro, a Spinumviva.
Também segundo o rascunho, para esta quinta-feira estaria prevista a ""entrega de respostas aos partidos"" sobre o caso (durante o debate, o primeiro-ministro foi acusado de não responder às perguntas dos partidos e da comunicação social). E, para o dia seguinte, conforme se pode ler, na agenda estaria também uma reunião de Conselho de Ministros, que de facto está marcada para sexta-feira às 10 horas. Segundo está anotado no documento, estaria ainda prevista, entre sexta-feira e segunda, uma entrevista ao primeiro-ministro a três canais de televisão (o que está ainda por confirmar).
A julgar pelo ponto de interrogação que antecede o sexto tópico, por decidir estaria se, depois da entrevista de Luís Montenegro, haveria ou não nova reunião de Conselho de Ministros para apresentação de medidas. Infraestruturas, Autoridade Nacional de Emergência e Proteção Civil (ANEPC) e a iniciativa ""Água que une"" estão incluídas nesse leque.
Ainda de acordo com o rascunho, o sétimo e último passo do conjunto de ações, depois de duas possíveis reuniões de Conselho de Ministros numa semana, seria o debate e votação da moção de confiança, que tem o chumbo anunciado do PS e toda a Esquerda.","<div class=""date""> 06 março, 2025 às 15:17 </div>"
"Marcelo quer incerteza política ""reduzida ao mínimo""",https://www.jn.pt/3123593525/marcelo-quer-incerteza-politica-reduzida-ao-minimo/,Governo,"O presidente da República considerou esta quinta-feira fundamental que a incerteza política seja “reduzida ao mínimo” e que as eleições autárquicas e presidenciais decorram “em normalidade”.
Em declarações aos jornalistas à saída de uma visita privada que fez com o Grão-Duque Henri do Luxemburgo ao Museu de Aristides de Sousa Mendes, em Cabanas de Viriato, Marcelo Rebelo de Sousa disse que, apesar de a Europa estar à procura da paz, esta demora a chegar e “isso dá uma incerteza política”.
“É fundamental garantirmos, naquilo que depende de nós, que essa incerteza é reduzida ao mínimo e que economicamente e socialmente as pessoas, com um mundo agitado, consigam enfrentar com a tranquilidade que é muito própria de Portugal”, frisou.
Na quarta-feira, o presidente da República admitiu eleições antecipadas em maio, no final de um dia em que o primeiro-ministro anunciou uma moção de confiança que tem chumbo prometido dos dois maiores partidos da oposição, PS e Chega, e que deverá ditar a queda do Governo na próxima semana.
Para Marcelo Rebelo de Sousa, o fundamental é que “a economia, a sociedade e a vida das pessoas continuem”, num período que não será “mais longo do que dois meses” e “antes ainda daquilo que possam vir a ser as eleições autárquicas e as eleições presidenciais em normalidade”.
O voto de confiança foi avançado por Luís Montenegro no arranque do debate da moção de censura do PCP, que foi rejeitada com a abstenção do PS na Assembleia da República, e em que voltou a garantir que “não foi avençado” nem violou dever de exclusividade com a empresa que tinha com a família, a Spinumviva.
Se a moção for rejeitada na quarta-feira no parlamento, Marcelo convocará de imediato os partidos ao Palácio de Belém “se possível para o dia seguinte e o Conselho de Estado “para dois dias depois"", admitindo eleições entre 11 ou 18 de maio.
O Conselho de Ministros reuniu-se por via eletrónica hoje de manhã e já aprovou o texto da moção de confiança que será entregue no parlamento, anunciou o Governo.","<div class=""date""> 06 março, 2025 às 14:37 </div>"
