title,link,category,Full Content,Date
Rui Rocha quer eleições “tão depressa quanto possível” e propõe 11 de maio,https://www.jn.pt/1406858753/rui-rocha-quer-eleicoes-tao-depressa-quanto-possivel-e-propoe-11-de-maio/,Iniciativa Liberal,"O presidente da IL, Rui Rocha, defendeu, esta quarta-feira, que o país deve ter eleições antecipadas “tão depressa quanto possível”, admitindo que podem realizar-se em 11 de maio.
À saída de uma audiência com o presidente da República, no Palácio de Belém, criticou o aconteceu na véspera, no debate parlamentar da moção de confiança, que apelidou como o “dia da irresponsabilidade”, defendendo uma “ideia de serviço dos interesses dos portugueses” e não “do taticismo e dos golpes palacianos”.
Rui Rocha considerou que Portugal deve ir a eleições “tão depressa quanto possível”.
""A terceira ideia que também transmiti ao senhor presidente, e que me parece que também recebeu acolhimento, é de que devemos ir a eleições tão depressa quanto possível, e isso aponta claramente, na perspectiva da Iniciativa Liberal, para eleições em 11 de Maio"", começou por adiantar, revelando mais à frente que ficou com a ideia que é uma data ""muito provável"".
Rui Rocha disse a Marcelo que o partido ""fará uma campanha ambiciosa, com medidas, com propostas, com desafios"", que permita o crescimento de Portugal, para trazer uma ""dimensão de responsabilidade e de sentido de serviço ao país"".
""Da nossa parte faremos tudo para que não sejam eleições pessoalizadas, focadas nas questões de caráter, nas questões pessoais. Nós queremos discutir o país, queremos discutir propostas"", prometeu.
Rui Rocha recordou que nas últimas legislativas o partido já foi sozinho a eleições e faz todo sentido que volte a ir agora, não se tratando de ""uma questão nem da circunstância, nem de pessoas"".
O líder da IL remeteu para o futuro uma posição sobre cenários de governabilidade, afirmando que o momento atual é para os partidos apresentarem as suas propostas.
Sobre a abertura, pelo Ministério Público, de uma averiguação preventiva relacionada com o primeiro-ministro e a empresa familiar, Rui Rocha escusou-se a fazer comentários e recorreu a ""uma frase estafada da política portuguesa"" segundo a qual ""à política o que é da política e à justiça o que é da justiça"".
""É fundamental que esta campanha sirva para trazer ideias ao país. Vamos ter uma campanha que vai ter muitos factos e muitas tentações de judicializarmos, de pessoalizarmos, e eu posso dizer é que quero muito que o país conheça as ideias dos partidos que se apresentam, a visão de país, o contributo de cada partido que quer dar, e parece-me que isso é o essencial"", defendeu.
Marcelo Rebelo de Sousa recebe hoje todos os partidos com assento parlamentar, na sequência da demissão do Governo PSD/CDS-PP causada pelo ‘chumbo’ da moção de confiança ao executivo.","<div class=""date""> 12 março, 2025 às 16:51 </div>"
Bloco de Esquerda defende eleições legislativas a 18 de maio,https://www.jn.pt/3680848565/bloco-de-esquerda-defende-eleicoes-legislativas-a-18-de-maio/,Crise política,"A coordenadora do BE defendeu, esta quarta-feira, que as eleições legislativas antecipadas devem acontecer no dia 18 de maio, justificando que devem ser “o mais rapidamente possível” mas “é preciso tempo” para a validação dos candidatos pelos partidos.
“Tivemos oportunidade de dizer ao Presidente da República que a data preferida ou que achamos mais razoável seria 18 de maio”, afirmou.
Mariana Mortágua falava aos jornalistas à saída de uma audiência com o Presidente da República, no Palácio de Belém, onde Marcelo Rebelo de Sousa recebe hoje todos os partidos com assento parlamentar, na sequência da demissão do Governo PSD/CDS-PP causada pelo chumbo da moção de confiança ao executivo.
A líder bloquista defendeu que as eleições legislativas antecipadas devem acontecer “o mais rapidamente possível, mas é precisão haver tempo” para acautelar as “obrigações legais de cada partido”.
“Por uma razão meramente administrativa, burocrática, pode ser difícil a paridos mais pequenos fazer a validação de candidatos e listas”, ressalvou.","<div class=""date""> 12 março, 2025 às 16:42 </div>"
Chega quer contribuir para estabilidade governativa sem Luís Montenegro,https://www.jn.pt/7744886568/chega-quer-contribuir-para-estabilidade-governativa-sem-luis-montenegro/,Chega,"André Ventura considerou, esta quarta-feira, que o seu partido está interessado em contribuir para uma solução de estabilidade governativa, mas afirma que o PSD ""tem de arrumar a casa"", porque não apoiará Luís Montenegro. ""É um não é não"" a Luís Montenegro e ao PS.
“Tive a oportunidade de transmitir que da parte do Chega haverá um contributo para qualquer cenário que seja, obviamente, de estabilidade, conquanto isso não implique abdicar das nossas bandeiras contra a corrupção, da nossa identidade pela transparência, isso nunca poderíamos fazer independentemente da situação política”, afirmou André Ventura.
O líder do Chega falava aos jornalistas à saída de uma audiência de cerca de 20 minutos com o Presidente da República, no Palácio de Belém, onde Marcelo Rebelo de Sousa recebe hoje todos os partidos com assento parlamentar, na sequência da demissão do Governo PSD/CDS-PP causada pelo 'chumbo' da moção de confiança ao executivo.
“Dissemos ao senhor Presidente da República que da nossa parte tudo faremos para que saia desta eleição uma solução, seja ela de construção governativa, seja ela de construção parlamentar, saia uma solução que dê ao país algum futuro, que eu acho que é isso que as pessoas querem”, defendeu.
André Ventura considerou que o PSD “teria de resolver” a “situação de Luís Montenegro” antes de “qualquer solução governativa que viesse a existir”.
“Se o Chega lutou para que este primeiro-ministro não continuasse, não faz sentido agora ter outra solução com este primeiro-ministro mais à frente”, afirmou, referindo que tem de haver “um esforço de todas as partes para essa solução”.
O líder do Chega afirmou que “a Luís Montenegro é um não é não, e não é nenhuma retaliação, é porque nestas circunstâncias é impossível haver confiança neste primeiro-ministro para poder governar”.
André Ventura rejeitou também entendimentos com o PS: “Era impossível qualquer aliança com o Partido Socialista, isso está fora de questão. Se nós estamos a dizer isto de Luís Montenegro, há um milhão de razões mais para não haver nenhum entendimento com o Partido Socialista, era preciso estar louco para haver um entendimento com o Partido Socialista, que é o partido mais corrupto que temos em Portugal”, disse.
Questionado se aceitaria fazer parte de um governo liderado por um primeiro-ministro que não tivesse ido a votos, Ventura admitiu essa solução, que disse não ser inédita, embora considere que “não é o cenário ideal para o país"".
“Não é a solução ideal, mas também não é a solução ideal estarmos de três em três meses em atos legislativos”, assinalou.
Sobre a abertura pelo Ministério Público de uma averiguação preventiva relacionada com o primeiro-ministro e com a empresa da sua família, o presidente do Chega disse que vê “com total naturalidade”, uma vez que o caso é público.
André Ventura disse que essa “é uma questão da Justiça” e há também “a questão política”, se “um primeiro-ministro com este tipo de suspeitas” deve ser candidato a primeiro-ministro ou “se tem condições para continuar” a exercer a função “sem uma explicação cabal de tudo isto”.
André Ventura chegou ao Palácio de Belém alguns minutos depois da hora a que deveria ter começado a reunião, acompanhado do líder parlamentar Pedro Pinto e do deputado Rui Paulo Sousa, ambos adjuntos da Direção Nacional do partido.
Sobre a reunião, Ventura disse ainda que o presidente da República pareceu estar “mais tendente” a marcar eleições legislativas antecipadas para dia 11 de maio.","<div class=""date""> 12 março, 2025 às 13:44 </div>"
"Pedro Nuno diz que eleições não são ""cenário desejável"" mas devem acontecer “o mais depressa possível”",https://www.jn.pt/4677810694/pedro-nuno-diz-que-eleicoes-nao-sao-cenario-desejavel-mas-devem-acontecer-o-mais-depressa-possivel/,PS,"Depois da reunião com o presidente da República, Marcelo Rebelo de Sousa, o líder do Partido Socialista (PS), Pedro Nuno Santos, garantiu aos jornalistas que as eleições ""não eram o cenário desejável para ninguém"", mas que é a ""única forma de clarificar a situação política em Portugal"".
""As eleições não eram o cenário desejável para ninguém, nem para os portugueses nem para nós. Mas, neste momento, é a única forma de clarificar a situação política em Portugal"", começou por dizer Pedro Nuno Santos, em declarações aos jornalistas presentes no Palácio de Belém.
O líder do PS defendeu ainda que os atos eleitorais não devem ser vistos ""como momentos que sejam um estorvo para a vida política e democrática"". ""Antes pelo contrário, é uma oportunidade para desbloquearmos a situação de crise política em que estamos e iniciarmos uma nova fase da vida politica com estabilidade, com confiança nas instituições, com confiança no Governo, com confiança no primeiro-ministro"", afirmou. ""É fundamental para que o país possa seguir em frente, resolver os seus problemas, problemas antigos, problemas novos, nomadamente os que não foram resolvidos no último ano"".
""Aquilo que de bom, como eu vos disse, que hoje o primeiro-ministro apresenta, é aquilo que já estava bem em Portugal há um ano. Eu já ouvi várias vezes o exemplo da fábrica da Volkswagen, ou da fábrica das baterias. São investimentos que já estavam previstos e cujo processo foi iniciado pelo Governo do Partido Socialista, não por este. Este dá continuidade"", acusou.
Para Pedro Nuno, as eleições devem acontecer “o mais depressa possível” e alertou que o país ""não pode andar de eleição em eleição"", culpando o ""manto de suspeição"" sobre o primeiro-ministro, que, segundo ele, é ""criador de instabilidade"". Para o líder do PS, é importante restituir “a confiança dos portugueses no primeiro-ministro, no Governo”. “O PS, eu próprio, estamos preparados para esta nova fase da vida política portuguesa. É um partido com uma grande experiência governativa, que também aprende com aquilo que correu bem, com aquilo que correu mal”, assegurou.
O secretário-geral do PS disse que só trabalha em cenário de vitória e avisou o PSD/CDS-PP que exigirá a mesma estabilidade que considera que o seu partido permitiu nesta legislatura.
“O Partido Socialista vai estar nesta campanha para ganhar as eleições. É o único cenário em que nós trabalhamos e, obviamente, que aquilo que nós fizemos durante este último ano na oposição foi garantir condições de estabilidade para que a AD pudesse governar”, disse. “Esse é o mínimo que, obviamente, entendemos que o PS tem o direito de poder exigir e acho que é um direito que não é só do PS, acho que é um direito do povo português que é poder ter, no próximo ciclo governativo, estabilidade, porque nós não podemos andar de eleição em eleição”.
O secretário-geral socialista também recusou comentar aabertura pelo Ministério Público de uma averiguação preventiva relacionada com o primeiro-ministro e a empresa familiar, aguardando “com cautela, prudência e respeito” o trabalho das outras instituições do Estado. “Eu não tenho nenhum comentário a fazer ao trabalho que a PGR fará. Nós temos que aguardar com cautela, com prudência e respeito pelo trabalho que as outras instituições do nosso Estado de direito democrático terão de fazer”, rematou.","<div class=""date""> 12 março, 2025 às 13:00 </div>"
Montenegro diz que há condições para realizar eleições a 11 de maio,https://www.jn.pt/656896830/montenegro-diz-que-ha-condicoes-para-realizar-eleicoes-a-11-de-maio/,Eleições,"O primeiro-ministro garante que apesar de o cenário de eleições legislativas antecipadas ""não ser o ideal"", ""não há razão para alarme"", enviando uma mensagem de segurança ao país. Luís Montenegro diz que os planos económicos não estão em causa e defende que há condições para as eleições se realizarem a 11 de maio.
""Não sendo um cenário desejável, ainda assim, temos todas as razões para poder dizer a Portugal que não vai haver uma perturbação nem do funcionamento do Governo nem da administração pública em curso"", garantiu Luís Montenegro em Belém, onde foi ouvido pelo presidente da República.
""O Governo em gestão pode tomar as decisões mais prementes, o cumprimento do PRR [Plano de Recuperação e Resiliência] não está em causa. Apesar de compreendermos que há preocupação, não há razão para alame"", asseverou, depois de nesta terça-feira o chumbo da moção de confiança no Parlamento ter lançado o país para as urnas.
""A solução para este impasse deve passar pela realização de eleições legislativas antecipadas. Impõe-se dar uma palavra de tranquilidade apesar de haver apreensão com a precipitação de mais uma eleição"".
O primeiro-ministro fez questão de destacar o cenário económico que o país vive, com ""alto emprego e baixo desemprego"", e garantiu que Portugal vai continuar a trabalhar com os seus parceiros internacioais, europeus e fora da Europa.
""Há condições para que as eleições ocorram num curto espaço de tempo. Cremos que há todas as condições para que elas se realizem numa dessas datas, a 11 e a 18, mas há todas as condições para que se realizem no dia 11 de maio"", respondeu aos jornalistas sobre a data para a realização do escrutínio, que vai ser decidida depois de Marcelo Rebelo de Sousa ouvir todos os partidos e dissolver a Assembleia da República.
""O período seguinte será a de apresentação de projetos, de candidaturas e é nisso que nos concentraremos nas próximas semanas. Os cenários pós-eleitorais serão alvo de debate na campanha para que os portugueses e as portuguesas possam ponderar o seu sentido de voto"", afirmou. "" A legislatura deveria ter durado quatro anos. Sabemos que o país olha para isto e questiona-se o porquê de aqui termos chegado"", reiterou, repetindo a mensagem que tinha deixado depois do debate que motivou a queda do Governo.","<div class=""date""> 12 março, 2025 às 12:20 </div>"
"PSD ""está unido na liderança de Luís Montenegro"", defende Miranda Sarmento",https://www.jn.pt/5768123381/psd-esta-unido-na-lideranca-de-luis-montenegro-defende-miranda-sarmento/,Eleições,"O ministro de Estado e das Finanças, Joaquim Miranda Sarmento, disse hoje que acredita que o PSD “está unido na liderança de Luís Montenegro”, depois da rejeição da moção de confiança que levou à queda do Governo.
“Creio que o PSD está unido na liderança de Luís Montenegro, que será o candidato a primeiro-ministro”, afirmou o governante, à margem da conferência Fórum da Banca, que se realiza hoje em Lisboa.
Joaquim Miranda Sarmento garantiu que o executivo “vai fazer o que normalmente um governo em gestão faz”, ao “tomar as decisões correntes” e deixar preparados os processos para “as decisões mais estratégicas serem tomadas pelo próximo” executivo.
O ministro acrescentou que vai agora continuar como ministro das Finanças do governo em gestão, “ajudar a AD a ganhar as eleições” e que, “depois, o primeiro-ministro tomará as decisões” sobre uma potencial nomeação no próximo executivo.
Questionado pelos jornalistas, Miranda Sarmento rejeitou ainda que esta crise política possa pôr em risco a economia nacional.
Ainda no encontro, Miranda Sarmento fez uma espécie de balanço do mandato do atual Governo, destacando, além das medidas, a subida do ‘rating’ da República Portuguesa pela Morningstar DBRS em janeiro e pela Standard & Poor’s em fevereiro.
“Claramente, as agências de ‘rating’ olham hoje para Portugal como um país seguro, estável e confiável”, registou, admitindo que também a Fitch poderá “seguir as outras duas agências e também subir” a classificação portuguesa.
Para os próximos anos, Miranda Sarmento apontou “várias reformas que o país tem de fazer”, destacando os setores da justiça, do sistema fiscal, do mercado laboral e, “provavelmente a menos referida, mas que é absolutamente fundamental”, da gestão financeira do setor público.
“Trazê-la dos anos 80 para a realidade da segunda década do século XX, para a realidade tecnológica e de gestão dos dias modernos”, sublinhou o atual ministro.
Na sessão, Miranda Sarmento registou a evolução do setor bancário nos últimos anos.
Na sua intervenção, o ministro assinalou que se o Estado mantiver a sua posição no Novo Banco “continuará a receber montantes em torno de 200 a 250 milhões de euros de dividendos”.
A crise política foi desencadeada há cerca de um mês após notícias sobre uma empresa familiar que pertenceu ao primeiro-ministro, a Spinumviva, levando à apresentação de duas moções de censura do Chega e PCP, ambas chumbadas.
Face às dúvidas que os partidos continuaram a manifestar, o primeiro-ministro anunciou a apresentação de uma moção de confiança, rejeitada na terça-feira, que provocou a queda do Governo.
As dúvidas sobre antiga empresa de Luís Montenegro, que antes de ir para o Governo passou à sua mulher e mais recentemente aos seus filhos, levou o PS a apresentar uma comissão parlamentar de inquérito para produzir resultados num prazo de 90 dias.
No debate em plenário, o Governo admitiu retirar a moção de confiança caso o PS reduzisse o tempo do inquérito para 15 dias, mas o PS rejeitou.
Após uma interrupção dos trabalhos durante meia hora, o PSD fez saber que propôs ao PS que o inquérito durasse até final do mês de maio, ou seja, cerca de dois meses, proposta que também foi rejeitada pelo PS. O requerimento do PS para uma comissão de inquérito propõe um prazo de até 90 dias.","<div class=""date""> 12 março, 2025 às 11:36 </div>"
"Futebol, Fátima e Eurovisão nos dias previstos para as eleições",https://www.jn.pt/4058118800/futebol-fatima-e-eurovisao-nos-dias-previstos-para-as-eleicoes/,Eleições,"Do futebol ao 13 de maio na Cova de Iria, as eleições legislativas podem coincidir com vários eventos nacionais e internacionais que prometem ""atrapalhar"" as caravanas dos partidos e o próprio ato eleitoral. As datas em cima da mesa são o 11 ou 18 de maio.
Fado, Futebol e Fátima. Aos três F’s temos que juntar, agora, as eleições legislativas previstas para maio. Nos dois fins de semana que estão na cabeça de Marcelo Rebelo de Sousa para os portugueses regressarem às urnas, não faltam acontecimentos de relevância.
Logo na primeira data apontada, a 11 de maio, o Benfica recebe o Sporting, no Estádio da Luz. O encontro da penúltima jornada do campeonato poderá realizar-se na véspera (ainda está por definir) mas será decisivo para as contas do título e pode terminar com a festa dos adeptos nas ruas. No Porto, mais um dérbi. O Boavista recebe o F. C. Porto no Bessa.
Da febre do futebol para a religião, a primeira data para o sufrágio também coincide com as aparições de Fátima. Nesse dia, antevéspera do aniversário de maio, já milhares de pessoas estarão na estrada a caminho do Santuário.
A verdade é que o 18 de maio também entra nas equações do presidente da República e o calendário não abranda. Nesse cenário, os últimos dias da campanha acontecem ao mesmo tempo que o 13 de maio. E, no mesmo dia, os Napa representam Portugal na semifinal do Festival da Eurovisão. O objetivo é conquistar o bilhete para a grande final do concurso europeu.
Nesse fim de semana, a final da Eurovisão realiza-se no hipotético dia de reflexão nacional, a 17 de maio. E há mais futebol. É nessa ocasião que se disputa a última jornada do campeonato, que poderá ditar o ponto final da corrida ao título de campeão nacional. O Braga recebe o Benfica, na Pedreira, e o Sporting termina a caminhada em casa com o Vitória de Guimarães. Já o F.C. Porto joga com o Nacional no Estádio do Dragão.
O mês de maio pode ainda marcar o início do julgamento da Operação Marquês, com José Sócrates no banco dos réus. A juíza Susana Seca vai marcar a data no dia 17 de março. O prazo para as defesas apresentarem a contestação termina no dia 8 de maio.","<div class=""date""> 12 março, 2025 às 12:02 </div>"
Partidos em clima de tensão para reverter a crise política,https://www.jn.pt/2810431985/partidos-em-clima-de-tensao-para-reverter-a-crise-politica/,exclusivoCrise política,"Telefonemas entre as bancadas, barulho de fundo e impasses marcaram o debate da moção de confiança.
O pós-debate da moção de confiança parecia estar desenhado: com os votos anunciados do PS e do Chega, o Governo seria demitido e o país caminharia para eleições legislativas antecipadas. A previsão confirmou-se, é certo, mas não sem antes haver várias tentativas para reverter o cenário de crise política. Um rodopio de propostas e contrapropostas lançadas entre PS e PSD, pontuadas por intervenções acaloradas, barulho de fundo e telefonemas entre as várias bancadas parlamentares.","<div class=""date""> 11 março, 2025 às 23:34 </div>"
Cartadas de última hora não travam eleições antecipadas,https://www.jn.pt/1676188603/cartadas-de-ultima-hora-nao-travam-eleicoes-antecipadas/,exclusivoChumbo,"Chumbo da moção de confiança fez cair Governo, que propôs reduzir prazo da comissão de inquérito. Marcelo ouve partidos e conselheiros.
O Governo caiu apesar da reviravolta de última hora que protagonizou no debate da moção de confiança, chumbada por toda a Oposição, exceto a IL, e o presidente da República já convocou para esta semana os partidos e o Conselho de Estado. Na última proposta para retirar a votação, Luís Montenegro impôs, sem sucesso, um prazo até fim de maio à comissão parlamentar de inquérito (CPI), em vez de 90 dias. O PS recusou e falou de “chantagem”.","<div class=""date""> 11 março, 2025 às 23:23 </div>"
Pedro Nuno acusa direita de desbaratar oportunidade dada pelo PS para governar,https://www.jn.pt/5088619109/pedro-nuno-acusa-direita-de-desbaratar-oportunidade-dada-pelo-ps-para-governar/,Queda do Governo,"O líder socialista acusou esta terça-feira a direita de ter desbaratado a oportunidade para governar que lhe foi dada pelo PS, afirmando esperar que o PSD tenha a mesma reciprocidade no futuro.
Pedro Nuno Santos deu esta noite uma entrevista à TVI/CNN, pouco tempo depois da votação da moção de confiança ao Governo ter sido rejeitada pelo parlamento, ditando a queda do executivo.
“A direita teve uma oportunidade única e desbaratou a oportunidade que o povo português lhe deu. Não merece outra oportunidade”, considerou.
Para o líder do PS, o Governo “cai por responsabilidade do primeiro-ministro”, Luís Montenegro, considerando que o PS “tinha dado todas condições ao Governo para governar”.
“Quando aprovámos o Orçamento do Estado estávamos a dar pelo menos um ano e meio de vida ao Governo”, disse.
Pedro Nuno Santos defendeu que “o mínimo que se pode exigir ao PSD é o mesmo que o PS deu” no próximo cenário pós-eleitoral.
“Vamos trabalhar para ter uma confiança do povo português que nos permita governar. O PS deu todas as condições para que este Governo pudesse governar”, enfatizou.
Por isso, o líder do PS pediu “uma reciprocidade” que no futuro “garanta o mesmo ao PS”.
“As coisas não estavam bem. Se há partido preparado para governar é o PS”, defendeu, considerando que os socialistas olharam “para a sua própria governação” e identificaram o que correu bem e o que correu menos bem.
Pedro Nuno Santos reiterou que o país está perante uma crise política “por causa de um caso que envolve pessoalmente o primeiro-ministro”, que “decidiu apresentar uma moção de confiança porque tem um caso sobre o qual não foi claro” sobre a empresa familiar.
“Não quero fazer insinuações. Nós temos dúvidas que queremos ver esclarecidos”, disse, acrescentando que “há algumas coisas” que já se sabem “ao dia de hoje e que são graves”.
Para o secretário-geral do PS, durante o debate da moção de confiança desta tarde o “Governo tentou montar um teatro, um circo para tentar responsabilizar o PS”, mas a crise política, na opinião do socialista, dependeu da apresentação desta moção de confiança que Luís Montenegro sabia que ia ser chumbada antes de a anunciar.
“Não estava em discussão a comissão de inquérito, estava em discussão uma moção de confiança. O Governo tentou fazer um jogo e não podemos legitimar os políticos que estão sempre a jogar com manobras, com taticismos”, defendeu.","<div class=""date""> 11 março, 2025 às 23:02 </div>"
