title,link,category,Full Content,Date
Chega apela a Marcelo que divulgue atas do Conselho de Estado,https://www.jn.pt/4181589305/chega-apela-a-marcelo-que-divulgue-atas-do-conselho-de-estado/,Dissolução,"O presidente do Chega apelou hoje ao Presidente da República que divulgue as atas da reunião do Conselho de Estado de 09 de novembro, na qual foi abordada a demissão do primeiro-ministro e a dissolução do parlamento.
Uma vez que não podemos esperar de António Costa a verdade, eu queria fazer um apelo ao presidente da República, que divulgue as atas do Conselho de Estado. Excecionalmente, pelo momento crítico em que vivemos, divulgue as atas do Conselho de Estado onde se discutiu precisamente a dissolução da Assembleia da República e a demissão do Governo"", afirmou André Ventura.
Em declarações aos jornalistas na Assembleia da República, o líder do Chega apontou que as atas do Conselho de Estado estão sujeitas a sigilo durante 30 anos, mas referiu que é possível excecionalmente, em alguns casos, permitir que ""sejam divulgadas com autorização do presidente da República"".
""E nós entendemos que este é um daqueles casos que justifica um regime excecional para se conhecer a discussão que houve no Conselho de Estado a propósito desta matéria"", defendeu.
Ventura sustentou que ""talvez a divulgação das atas do Conselho de Estado permita ao país compreender com firmeza e clareza os factos que levaram à demissão do primeiro-ministro, e não esta sequência de mentiras em que António Costa quer enredar o país e que insiste em manter a cada dia que passa, com uma narrativa diferente, com mais mentiras e com maior ocultação da verdade"".
O líder do Chega defendeu também que a ""procuradora-geral da República pode prestar um esclarecimento sobre quem a convocou para ir ao Palácio de Belém"".
Nesta comunicação aos jornalistas, o presidente do Chega criticou também a possibilidade de ""centenas ou dezenas de casos"" de nomeações feitas pelo atual Governo para as novas Unidades Locais de Saúde e indicou que o partido vai propor, no âmbito do Orçamento do Estado, que estas nomeações sejam em regime de substituição, proposta que o PSD também anunciou de manhã que terá.
""Estamos a falar de um Governo que terá mais dois meses e meio de existência e que deixará um conjunto de pessoas em lugares nomeados ao longo dos próximos anos. Isto é inadmissível e mostra bem como o PS está agarrado as estruturas de poder e não as quer largar"", defendeu.
Apontando também que ""o PS está a insistir nesta Assembleia da República para que os dirigentes da Anacom e da ANA seja efetivamente nomeados"", André Ventura considerou que ""não faz sentido haver nomeações no momento em que faltam dois meses e tal ou três para haver eleições"".
Reuniões ""não são públicas""
De acordo com a Constituição, as reuniões do órgão político de consulta do presidente da República ""não são públicas"".
O regimento do Conselho de Estado indica que ""as atas do Conselho de Estado não podem ser consultadas nem divulgadas, durante um período de 30 anos a contar do final do mandato presidencial em que se realizaram as reuniões a que respeitam"".
Após esse período, ""a consulta e a divulgação das atas podem ser efetuadas por solicitação dirigida ao presidente da República"".
O regimento indica ainda que ""ficam ressalvadas a consulta e divulgação das atas, no todo ou em parte, em casos excecionais por decisão do presidente da República"".
Na segunda-feira, o primeiro-ministro escusou-se novamente a revelar se e quando pediu ao presidente da República para chamar ao Palácio de Belém a procuradora-geral da República e lembrou que há ""dever de confidencialidade"" no Conselho de Estado.
António Costa tinha sido questionado na Alemanha sobre a revelação, por parte do conselheiro de Estado António Lobo Xavier, de que foi em sede de Conselho de Estado que o primeiro-ministro adiantou ter sido ele próprio a pedir a Marcelo Rebelo de Sousa que chamasse Lucília Gago ao Palácio de Belém sobre a investigação ""Operação Influencer"".
No passado sábado, António Costa já afirmara não se recordar de ter falado publicamente sobre quem chamou ao Palácio de Belém a procuradora-geral da República e salientou que nunca transmite por heterónimos conversas com o presidente da República, isto depois de Marcelo Rebelo de Sousa ter revelado, em Bissau, na sexta-feira, que foi o primeiro-ministro quem lhe pediu para chamar Lucília Gago ao Palácio de Belém para esta lhe dar explicações sobre o processo em que o ainda líder do executivo está envolvido.","<div class=""date""> 21 novembro, 2023 às 17:35 </div>"
PSD quer suspensão de novas unidades de saúde e nomeações apenas de substituição,https://www.jn.pt/7726926732/psd-quer-suspensao-de-novas-unidades-de-saude-e-nomeacoes-apenas-de-substituicao/,SNS,"O PSD apelou esta terça-feira à suspensão da entrada em vigor das futuras Unidades Locais de Saúde (ULS), prevista para 1 de janeiro, ou, pelo menos, que a nomeação dos seus dirigentes seja feita em regime de substituição.
Em declarações à Lusa, o vice-presidente do PSD Miguel Pinto Luz acusou o PS de, ""em vez de estar preocupado em resolver os problemas negociais com os médicos"" que afetam o Serviço Nacional de Saúde (SNS), estar focado em ""aprovar leis à medida no parlamento para continuar a alimentar uma máquina socialista que se serve do interesse do Estado"".
""Refiro-me a um aditamento que o PS pretende levar a votação [no Orçamento do Estado] que delega na direção executiva do SNS a capacidade de nomear mais de 300 lugares de chefia, nomeadamente para as novas ULS que entram em vigor em janeiro, durante o ano de 2024"", disse.
Para Pinto Luz, esta situação ""traz à lembrança situações passadas em que o PS é pródigo em pôr a sua máquina ao serviço do pior aparelhismo"".
""O PSD vem de uma forma muito clara colocar isto a nu, apelar ao PS para que suspenda a entrada em vigor de uma reforma tão dramática como é esta, da generalização das ULS"" para depois da posse do novo Governo, disse.
Caso o PS insista que estas novas ULS devem entrar em funcionamento em janeiro, o PSD vai propor no parlamento que as nomeações dos seus dirigentes sejam feitas ""em regime de substituição"", permitindo ""não onerar o próximo Governo"", que depois poderia ""fazer as suas legítimas escolhas num novo quadro de gestão do SNS"".
""E não para garantir o poleiro a mais 'boys', a mais militantes do PS, colocando sempre os interesses do PS à frente dos interesses dos portugueses"", criticou, defendendo que ""o mais sério"" seria suspender a entrada em vigor da reforma, que acontecerá já com o Governo em gestão.
O vice-presidente do PSD recordou que o partido deixou sempre claro que considera que a generalização das ULS ""não é a solução"" e poderá ser ""um erro histórico"", por tratar ""de forma igual o que é diferente"", e chegou a entregar no parlamento um pedido de apreciação do decreto do Governo pela Assembleia da República, que já não será apreciado com a demissão do executivo e futura dissolução parlamentar.
Em setembro, o diretor-executivo do SNS, Fernando Araújo, anunciou uma ""grande reforma"" a partir de janeiro de 2024 com a criação de 31 ULS - que integram os hospitais e os centros de saúde numa mesma instituição e gestão -, e que se juntam às oito já existentes.
Na proposta de aditamento do PS, que será debatida e votada na especialidade no âmbito da discussão orçamental, refere-se que ""durante o ano de 2024 a competência para a designação dos membros dos órgãos de gestão dos institutos portugueses de oncologia e unidades locais de saúde (...) é da Direção Executiva do Serviço Nacional de Saúde"",
Na nota justificativa, os deputados socialistas recordam que a resolução do Conselho de Ministros de 13 de julho confere nesta direção executiva esta competência.
""Importa reforçar que a diversidade e a complexidade desta nova vaga de ULS exige um ajuste no que se refere aos seus órgãos de administração (...) determinando a possibilidade de nomeação de um máximo de seis vogais executivos, em função da dimensão e complexidade do estabelecimento de saúde"", refere.
Assim, o conselho de administração deverá incluir, para além do presidente da ULS, até dois diretores clínicos, um enfermeiro diretor, um vogal proposto pelo membro do Governo responsável pela área das finanças e um vogal proposto pela Comunidade Intermunicipal ou pela Área Metropolitana, consoante a localização da ULS.
Para o PS, ""importa garantir que a Direção Executiva do Serviço Nacional de Saúde mantém a competência para designar os membros dos órgãos de gestão das ULS"".","<div class=""date""> 21 novembro, 2023 às 15:28 </div>"
Start Campus aponta “equívocos” que ameaçam projeto em Sines,https://www.jn.pt/4795863701/start-campus-aponta-equivocos-que-ameacam-projeto-em-sines/,Operação Influencer,"A Start Campus, que foi constituída arguida na operação Influencer, disse esta segunda-feira que havia “equívocos” sobre o impacto ambiental do centro de dados de Sines que ameaçam a “continuidade de projeto chave”, segundo um comunicado.
Na nota, a empresa, agora liderada por Robert Dunn, na sequência da renúncia de Afonso Salema e Rui Oliveira Neves, também constituídos arguidos, indicou que “reafirma compromisso ambiental e garante que espécies protegidas não estão em risco”.
Para a empresa, existem “equívocos sobre impacto ambiental do centro de dados da Start Campus” que ameaçam a “continuidade de projeto-chave”.
“A construção do projeto Sines 4.0, um centro de dados hyperscaler desenvolvido pela Start Campus, e que irá contribuir para um forte desenvolvimento da economia local e nacional, está a estabelecer novos padrões de responsabilidade ambiental e de criação de ecossistemas verdes”, assegurou.
“Localizado na Zona Industrial de Sines, no local de um aeródromo desativado, entre uma linha ferroviária e uma central elétrica a carvão, o trabalho de construção no primeiro edifício do projeto de 3,5 mil milhões de euros está perto de ser concluído, será alimentado a energia renovável e criará quase 10 mil novos empregos”, garantiu ainda.
A empresa destacou que este primeiro edifício, conhecido como “NEST” está ""situado inteiramente fora da Rede Natura, que protege habitats de flora e fauna”, acrescentando que “esta fase da construção não está sujeita a uma avaliação de impacto ambiental (AIA) pela Agência Portuguesa do Ambiente (APA)”, tendo esta entidade, no entanto, adicionado “uma condição ao projeto, exigindo que a Start Campus protegesse as plantas 'Erica cirialis' e 'Erica erigena' ao redor do local”.
A Start Campus garantiu que cumpriu com esta exigência, “em estreita colaboração com especialistas no habitat local sobre como proteger as plantas”.
Na mesma nota, a empresa indicou que ""a construção do NEST está quase completa - a expectativa é que o mesmo esteja totalmente operacional em março de 2024”, destacando que além deste edifício, “nenhuma outra construção foi feita” e que “as subsequentes fases planeadas estão dentro da Rede Natura, e encontram-se em fase de desenho e licenciamento”.
“A Start Campus está a trabalhar em estreita colaboração com as autoridades relevantes para garantir que cumpre todos os requisitos para o respeito da Rede Natura antes que qualquer trabalho seja iniciado”, destacou.
""Entendemos as preocupações em torno do desenvolvimento do nosso primeiro edifício; estamos a fazer tudo o que podemos para provar que a Start Campus está a fazer o que está certo, em todos os momentos”, disse Robert Dunn, presidente executivo (CEO) da empresa, no comunicado.
O Ministério Público (MP) deteve cinco pessoas no âmbito deste processo: o então chefe de gabinete do primeiro-ministro, Vítor Escária, o presidente da Câmara de Sines, Nuno Mascarenhas, dois administradores da Start Campus, Afonso Salema e Rui Oliveira Neves, e o advogado Diogo Lacerda Machado, amigo de António Costa, que no final do interrogatório judicial foram colocados em liberdade.
No total, há nove arguidos na investigação aos negócios do lítio, hidrogénio verde e do centro de dados de Sines, entre eles o agora ex-ministro das Infraestruturas, João Galamba, o presidente da Agência Portuguesa do Ambiente (APA), Nuno Lacasta, o advogado e antigo porta-voz do PS João Tiago Silveira e a Start Campus.","<div class=""date""> 20 novembro, 2023 às 16:46 </div>"
Montenegro diz que “não vai fazer o frete” de comentar o que se passa no PS,https://www.jn.pt/7892647797/montenegro-diz-que-nao-vai-fazer-o-frete-de-comentar-o-que-se-passa-no-ps/,Crise política,"O presidente do PSD, Luis Montenegro, garantiu esta segunda-feira, no Porto, que não vai “fazer o frete” ao PS de “estar todos os dias a comentar” o que se passa naquele partido e que está “concentrado no futuro” do país.
“Sinceramente, eu não vou fazer o frete ao Partido Socialista de estar todos os dias a comentar aquilo que se está a dizer do Partido Socialista de um lado e para o outro. Eu estou concentrado no futuro do país, nas pessoas, naquilo que são os desejos que os cidadãos portugueses, frustrados que foram por aquilo que foi o seu voto nas últimas eleições legislativas, queiram ver resolvidos”, afirmou Luís Montenegro no final de uma reunião na Associação Nacional de Jovens Empresários.
Confrontado com a acusação do primeiro-ministro, António Costa, ao Presidente da República de que faltou bom senso para evitar uma crise política, o líder do PSD escusou-se a comentar: ""O comentário que me merece é que Portugal deve criar mais riqueza, deve ter uma fiscalidade mais amiga dos cidadãos, deve ter menos asfixia nas empresas para que elas possam investir”, respondeu.
Luis Montenegro optou por abordar o posicionamento de Portugal na União Europeia, considerando que o país ""não tem estar sempre na cauda” da Europa.
“Porque é que Portugal tem que estar sempre na cauda, porque é que nós não somos capazes de estar na linha da frente, porque é que não somos capazes de assumir como desígnio para Portugal deixarmos de ser beneficiários de fundos e passarmos a ser contribuintes da Europa”, questionou.
Para o líder social-democrata, “é isso que as pessoas querem de um partido que quer governar o país”.
“É isso que eu quero oferecer aos portugueses, com todo o respeito pelas outras questões”, salientou.
Questionado sobre outras questões da atual crise politica que levou à queda do Governo socialista de maioria absoluta, Montenegro optou por salientar alguns dos objetivos do PSD para a área da Economia.
“Sinceramente eu hoje estou focado em poder dizer que é preciso baixar o IRS sobre a classe média, é preciso incentivar a produtividade, isentando de contribuições e impostos uma margem de rendimento que tenha a ver com prémios de desempenho e disponibilidade para trabalho suplementar, é importante que os jovens portugueses saibam que até aos 35 anos vão pagar um terço do IRS do que aquilo que normalmente pagariam, que possam projetar com previsibilidade as suas vidas a uma escala de 10, 15, 20 anos”, apontou.","<div class=""date""> 20 novembro, 2023 às 14:37 </div>"
"""Este ambiente de corrupção é pior para as empresas do que a mudança de Governo”",https://www.jn.pt/3437201771/este-ambiente-de-corrupcao-e-pior-para-as-empresas-do-que-a-mudanca-de-governo/,Crise política,"O secretário-geral da Associação Cristã de Empresários e Gestores (ACEGE), Jorge Líbano Monteiro, considera que a instabilidade governativa que o país atravessa é prejudicial para a vida das empresas, mas refere que pior ainda para a atividade empresarial é “o ambiente de corrupção que está instaurado”.
Jorge Líbano Monteiro afirma que muitos empresários “deixaram de confiar no Estado”, embora ainda subsista a subsídio-dependência e “uma ligação excessiva” entre ambos. Considerações feitas em Viana do Castelo, onde a ACEGE se prepara para criar o seu 14.º núcleo regional em território nacional.
Questionado sobre o impacto na vida das empresas portuguesas, deste período até às eleições em março de 2024, e eleição de um novo Governo, seguida de uma nova proposta de Orçamento do Estado, aquele responsável, respondeu: “Tudo o que é instabilidade é um problema. Se calhar, este ambiente de corrupção que está instaurado é pior para as empresas que a mudança de Governo. Uma empresa que tem que trabalhar sempre com este ambiente de corrupção, com esta incapacidade de fazer as coisas com critérios claros, transparentes e objetivos é pior para as empresas, se calhar, do que a mudança de Governo ou de linha política”, sublinhou.
Para o secretário-geral da ACEGE, que defende valores como a humanidade, ética, conciliação de família e trabalho, cumprimento de prazos de pagamento e combate à pobreza nas empresas, a instabilidade governativa “é o pior que pode acontecer” aos empresários.
“O que as empresas querem, acima de tudo, é estabilidade e essa estabilidade não está a ser conseguida. E, infelizmente, não está a ser conseguida por falta de ética, o que é mais frustrante ainda. Se fosse um problema mais grave, estrutural, neste mundo tão instável onde estamos, com guerras, com situações muito complicadas em tudo, no fundo vemos aqui a situação nacional ser alterada drasticamente por falta de ética”, comentou Jorge Líbano Monteiro, referindo que “aos poucos,as empresas habituaram-se a trabalhar mais longe do Governo”.
Governo ""já não é aprceiro de confiança""
“Isso tem acontecido nos últimos anos. O Governo já não é um parceiro de confiança muitas vezes, portanto, as empresas podendo avançar sozinhas, muitas vezes preferem-no”, disse, considerando que, por outro lado, “há muitas empresas ainda muito encostadas ao Estado e aos seus subsídios, mas acho que esse não é o caminho das empresas que querem ser grandes. O caminho das que querem ser grandes, é fazer-se à vida e avançar sozinhas, porque é assim que elas podem crescer com mais sustentabilidade e com mais segurança”, defendeu, considerando que compete ao Estado, “assegurar as bases estruturais para que as empresas possam funcionar”.
“Tem obrigação de ter uma Justiça célere, para que as coisas possam ser resolvidas nos tribunais sem ter de estar anos à espera, e de ter Educação que garanta futuros quadros das empresas, de acordo com as necessidades de mão de obra. Chegámos a esta situação, em que a mão de obra tem de vir toda de fora, porque não há portugueses capacitados para fazer determinadas funções que as empresas precisam”, declarou.
A ACEGE foi criada em 1954 e tem atualmente 1200 empresários associados em Portugal.
A sua missão é tornar “as empresas e as suas equipas mais felizes”, transmitindo-lhes “uma missão de humanidade”.
Um dos cinco projetos que está a desenvolver atualmente é o Pagamento Pontual, que tem por objetivo “pedir aos empresários que paguem a horas”.
“Em Portugal, 84% das empresas não paga no prazo. Só 4% das grandes empresas é que paga no prazo que definem”, afirma Jorge Monteiro, referindo que a iniciativa envolve “2500 pequenas e grandes empresas”.
“Hoje em dia, felizmente, os pagamentos aos trabalhadores, a não ser em situações de crise, são feitos no dia certo. Já com os fornecedores não é a mesma coisa. As pessoas não têm respeito, não percebem o mal que fazem por pagarem atrasado. Por vezes, isso cria uma bola de neve e há pessoas que são despedidas e empresas que acabam por falir devido a esses pagamentos atrasados”, frisou.","<div class=""date""> 20 novembro, 2023 às 11:20 </div>"
"Alberto Martins, Isabel e João Soares com a candidatura de Pedro Nuno",https://www.jn.pt/5005345520/alberto-martins-isabel-e-joao-soares-com-a-candidatura-de-pedro-nuno/,PS,"O antigo ministro socialista Alberto Martins e Isabel e João Soares, filhos do fundador e primeiro líder do PS, Mário Soares, manifestam apoio à candidatura de Pedro Nuno Santos ao cargo de secretário-geral do PS.
Estes três nomes foram adiantados à agência Lusa por fonte da candidatura de Pedro Nuno Santos à liderança do PS, cujas eleições diretas internas estão marcadas para 15 e 16 de dezembro, e o congresso para o período entre 05 e 07 de janeiro.
Alberto Martins, que liderou a revolta académica de 1969 na Associação Académica de Coimbra contra o regime do Estado Novo, foi ministro da Reforma de Estado no segundo Governo de António Guterres e ministro da Justiça no segundo executivo de José Sócrates.
Entre outros cargos políticos, foi membro do Secretariado Nacional do PS e presidente do Grupo Parlamentar socialista sob a liderança de António José Seguro. Em 2017, decidiu sair do seu lugar de deputado do PS na Assembleia da República e afastou-se da primeira linha da vida política.
Já em relação aos dois filhos do fundador, primeiro secretário-geral do PS e antigo Presidente da República, Isabel Soares preside à Fundação Mário Soares/Maria Barroso.
Tal como Alberto Martins, João Soares também não tem exercido funções políticas públicas depois de ter desempenhado as funções de ministro da Cultura no primeiro Governo de António Costa. Dentro do PS, João Soares, antigo presidente da Câmara de Lisboa, apoiou a liderança socialista de António José Seguro entre 2011 e 2014.
Ainda no que respeita a apoios de destacados socialistas para as eleições diretas de dezembro, a candidatura do ex-ministro das Infraestruturas e da Habitação tem ainda os apoios do antigo ministro João Cravinho e de Manuel Alegre, membro do Conselho de Estado e candidato nas presidenciais de 2006 e 2011.
No domingo, a candidatura de Pedro Nuno Santos divulgou uma lista em que 79 dos 120 deputados do Grupo Parlamentar do PS manifestam apoio ao ex-ministro, antigo líder da JS e atual deputado por Aveiro.
Entre os 79 deputados socialistas estão vice-presidentes da bancada como Porfírio Silva, Pedro Delgado Alves, Rui Lage, Francisco César ou Carlos Pereira, bem como a secretária nacional do PS com o pelouro da administração, Vera Braz.","<div class=""date""> 20 novembro, 2023 às 10:46 </div>"
