title,link,category,Full Content,Date
Carneiro critica Governo e compara Conselho de Ministros a arruada,https://www.jn.pt/4833319811/carneiro-critica-governo-e-compara-conselho-de-ministros-a-arruada/,Legislativas,"O antigo candidato à liderança do PS José Luís Carneiro acusou, esta quarta-feira, o Governo de ter colocado o Estado ao serviço daquilo que comparou com “uma arruada”, referindo-se ao Conselho de Ministros realizado no Mercado de Bolhão, no Porto.
À entrada para a Comissão Política Nacional do PS, que esta noite vai aprovar as listas definitivas do partido às eleições legislativas de 18 de maio, José Luís Carneiro foi questionado sobre a decisão do secretário-geral socialista de o voltar a colocar a liderar a lista por Braga, depois da conturbada reunião federativa de terça-feira à noite.
“O que nós queremos é servir Portugal e servir os portugueses. É aquilo que todos nós queremos, independentemente dos lugares que cada um ocupa momentaneamente”, começou por responder, desvalorizando a polémica na reunião da federação do PS/Braga que chumbou a lista.
Segundo o cabeça de lista por Braga, o objetivo do PS são “compromissos claros, servir as pessoas e colocar o estado ao serviço do país e da sociedade”.
“E não colocar o estado ao serviço daquilo que hoje mais parecia uma arruada no Porto, feita pela Governo da República”, criticou, numa referência ao Conselho de Ministros que hoje se realizou no Mercado de Bolhão e que mereceu muitas críticas da oposição.
O PS apresentou hoje uma queixa na Comissão Nacional de Eleições (CNE) contra a concelhia do PSD/Porto pela mensagem enviada aos militantes a convidá-los a cumprimentar o primeiro-ministro no Mercado do Bolhão, local do Conselho de Ministros.
Momento antes, em conferência de imprensa na sede do PS, em Lisboa, o socialista Marcos Perestrello acusou o Governo de “instrumentalização do Estado ao serviço” dos interesses dos partidos e de “promiscuidade entre o que é privado, público e partidário”, considerando que o executivo está a fazer “campanha para o PSD”.
O primeiro-ministro, Luís Montenegro, rejeitou ter violado ""deveres de neutralidade e de isenção"" ao fazer um Conselho de Ministros no Mercado do Bolhão, no Porto, onde entrou ladeado pelo hoje anunciado candidato à Câmara do Porto, Pedro Duarte.
No final do Conselho de Ministros, que se realizou no Mercado do Bolhão, no Porto, o executivo de Montenegro seguiu, a pé, para um almoço na Rua Santa Catarina onde aproveitou para distribuir beijos e votos de saúde.
O Governo esclareceu que informou todos os grupos parlamentares sobre a realização do Conselho de Ministros no Porto e convidou deputados de todos os partidos, como acontece habitualmente nestas deslocações.
Este esclarecimento foi feito por fonte do Governo à Lusa, depois de o primeiro-ministro, Luís Montenegro, ter sido questionado sobre o envio de mensagens a militantes do PSD para estarem presentes hoje no Mercado do Bolhão, que disse desconhecer.","<div class=""date""> 02 abril, 2025 às 23:44 </div>"
Legislativas: Portugueses preferem estabilidade seja quem for o vencedor,https://www.jn.pt/7058462869/legislativas-portugueses-preferem-estabilidade-seja-quem-for-o-vencedor/,Sondagem,"É uma das questões mais pertinentes do pós-eleições e já começa a dominar o debate em torno do resultado de 18 de maio. Devem a AD ou o PS viabilizar o Governo um do outro, caso percam as legislativas? A maioria dos portugueses afirma que sim. Mas o Chega tem de ficar fora da equação.
Se a Aliança Democrática renovar a vitória nas legislativas, o Partido Socialista deve voltar a permitir que Luís Montenegro governe - mas sem o apoio do Chega -, tal como fez em março do ano passado. Esta é a opinião de 77% do eleitorado, de acordo com a mais recente sondagem da Pitagórica para o JN, TSF e TVI/CNN. Para 17% dos inquiridos, o PS não deve deixar que a AD forme Governo.
No cenário inverso, a tendência dos portugueses mantém-se, ainda que com menos expressão. No caso de o PS ganhar as eleições sem maioria absoluta, 61% dos portugueses consideram que o PSD deve permitir que Pedro Nuno Santos seja primeiro-ministro e 32% são contra a concordância dos sociais-democratas. O secretário-geral socialista, que em 2024 admitiu viabilizar um Governo da AD sem obter a reciprocidade de Luís Montenegro, já afirmou que a coligação deveria ter o mesmo comportamento que o PS teve no passado. Por outro lado, o atual ministro da Presidência, António Leitão Amaro, recusou antecipar cenários pós-eleitorais, sugerindo que o PSD se sente desobrigado a dar o aval a um executivo do PS.
O sinal claro de estabilidade dado pelos inquiridos à viabilização de um Governo da AD pelo PS (e vice-versa) é unânime e independente do sexo, faixa etária, geografia, classe social ou orientação política, de acordo com a amostra recolhida pela Pitagórica. Ainda assim, os portugueses que mais aplaudem o aval socialista a um Governo da AD sem o Chega são os homens (80%), os eleitores com mais de 65 anos (81%) e os que têm melhores rendimentos (83%).
Por outro lado, as mulheres (61%), os votantes acima dos 65 anos (65%) e os que fazem parte de uma classe social superior (65%) são quem mais concorda com a “luz verde” da AD a um Governo do PS, caso seja este partido a sair vitorioso a 18 de maio. Em ambos os cenários, os menos favoráveis são os eleitores do Chega.
Por falar no partido de André Ventura, a maioria do eleitorado é da opinião que o PSD faz bem em afastar-se do mesmo. De acordo com o barómetro da Pitagórica, 73% concorda ou concorda totalmente com a posição de Luís Montenegro de não governar com o Chega e apenas 17% apresenta uma opinião contrária. Quem mais condena a posição assumida pelo atual primeiro-ministro é, sem surpresas, o eleitorado que vota em André Ventura (61%) e, em proporções mais reduzidas, os homens, os que têm 25 a 44 anos e os que têm rendimentos mais reduzidos.
Ainda sobre a relação entre os dois políticos, são mais os portugueses que concordam com o “não” de Montenegro a Ventura do que o contrário. De acordo com os dados, 43% dos inquiridos acham que o líder do Chega faz bem em não apoiar um Governo liderado pelo presidente do PSD e 28% discordam com a posição de Ventura. Já a maioria (57%) é da opinião que o líder do Chega fez bem em avisar que não apoiará Luís Montenegro.
Com as linhas vermelhas traçadas entre a AD e o Chega, mais de metade dos eleitores acha que a coligação não deve permitir que André Ventura seja primeiro-ministro, num cenário em que o Chega vença as eleições. Para 60% dos inquiridos, onde as mulheres surgem em destaque, o cenário deve ser rejeitado. Além do sexo feminino, quem mais condena a ideia de Ventura chegar ao poder com o aval da AD são os eleitores de Esquerda (CDU, Livre e Bloco de Esquerda).
Dos 37% que acham que a AD deve deixar que o líder do Chega seja primeiro-ministro, destacam-se os homens, os que têm entre os 35 e os 44 anos, os que pertencem à classe média e os residentes no Sul (onde o partido de Ventura cresceu significativamente nas últimas legislativas) e ilhas.
E se através da sondagem da Pitagórica, é evidente que os portugueses defendem que quem ganha as eleições forme Governo, independentemente de ser o PS ou a AD, e rejeitam a importância do Chega no cenário pós-eleitoral, também é claro que a figura de Luís Montenegro não é unânime. No caso de vitória da AD a 18 de maio sem a viabilização do Chega, 49% é da opinião que o PSD deve apresentar um novo candidato a primeiro-ministro e 45% acha que os sociais-democratas devem insistir em Luís Montenegro.
Quem mais apela à renovação da figura principal do PSD são os jovens entre os 18 e os 24 anos, os que pertencem à classe média e os votantes na CDU, Livre e Chega. Por outro lado, o voto de confiança ao atual primeiro-ministro surge com maior expressão no Norte do país, entre os homens, os que têm 45 a 54 anos e os que têm tendimentos mais elevados.

Sondagem realizada pela Pitagórica para a TVI, CNN Portugal, TSF e JN, com o objetivo de avaliar a opinião dos portugueses sobre temas relacionados com a atualidade do país. O trabalho de campo decorreu entre os dias 24 e 29 de março de 2025. A amostra foi recolhida de forma aleatória junto de eleitores portugueses recenseados e foi devidamente estratificada por género, idade e região. Foram realizadas 1626 tentativas de contacto, para alcançarmos 1000 entrevistas efetivas, pelo que a taxa de resposta foi de 61,50%. As 1000 entrevistas telefónicas recolhidas correspondem a uma margem de erro máxima de +/- 3,16% para um nível de confiança de 95,5%. A direção técnica do estudo é da responsabilidade de Rita Marques da Silva. A ficha técnica completa, bem como todos os resultados, foram depositados junto da ERC - Entidade Reguladora da Comunicação Social, que os disponibilizará para consulta online.","<div class=""date""><span>01 abril, 2025</span></div>"
Pedro Nuno acusa Montenegro de ter fugido sistematicamente ao escrutínio,https://www.jn.pt/1335174180/pedro-nuno-acusa-montenegro-de-ter-fugido-sistematicamente-ao-escrutinio/,PS,"O líder do PS acusou hoje o primeiro-ministro de ter fugido sistematicamente ao escrutínio da comunicação social, considerando que não existirá uma democracia saudável se os políticos não o fizerem porque essa é uma das suas obrigações.
Pedro Nuno Santos abriu esta manhã a sessão temática sobre “Democracia, Transparência e Direitos Fundamentais”, no âmbito do Manifesto Legislativas 2025, considerando que há “elementos que retiram confiança das pessoas nos políticos”.
“Aquilo que nós assistimos nos últimos meses foi uma forma de um governo, de um primeiro-ministro se relacionar com um país que já não é aceitável nos dias de hoje. Não tem a ver só com os casos das últimas semanas”, criticou o secretário-geral socialista, considerando que Luís Montenegro fugiu “sistematicamente do escrutínio da comunicação social”.
Segundo o líder do PS, não haverá “uma democracia saudável se os políticos acharem que podem fugir ao escrutínio”.
“Uma das nossas obrigações é estarmos sempre disponíveis para ser escrutinados e para dar todos os esclarecimentos, sempre que há dúvidas, sobre a conduta de qualquer titular de cargo político”, defendeu.
Na opinião de Pedro Nuno Santos, quando se iniciou a atual crise política “este afastamento e ausência de respostas” do primeiro-ministro aumentou.
“Um político não pode fugir nem evitar o escrutínio. Eu próprio já fui escrutinado”, defendeu.
O secretário-geral do PS admitiu que “são muitos os portugueses que se questionam das razões” para haver eleições antecipadas, repetindo uma ideia que tem defendido na abertura destas sessões: “o PS não desejou estas eleições”.
“O primeiro-ministro, neste esforço por evitar o escrutínio, usou a moção de confiança para tentar condicionar um inquérito parlamentar, primeiro a sua própria existência depois condicionar o seu funcionamento”, condenou.
Pedro Nuno Santos defendeu que “a liderança e o projeto político são duas faces da mesma moeda” e apontou que “esta forma de atuação teve reflexo na própria governação”.
Outro dos aspetos que o líder do PS apontou nesta intervenção – a parte da sessão aberta à comunicação social já que o restante debate é fechado – é a existência de um “discurso com alguma violência” que recupera elementos discriminatórios.
Segundo Pedro Nuno Santos há um “avanço da extrema-direita e das suas ideias” e defendeu “uma ideologia de igualdade e de respeito”.
“Aquilo que nós defendemos é uma coisa tão simples como igualdade”, disse.","<div class=""date""> 01 abril, 2025 às 13:25 </div>"
Sondagem Legislativas: AD deixa PS para trás. Chega é o que mais perde. Livre cresce com a crise,https://www.jn.pt/1547311803/sondagem-legislativas-ad-deixa-ps-para-tras-chega-e-o-que-mais-perde-livre-cresce-com-a-crise/,Barómetro,"Já não há empate técnico. Se o país fosse por estes dias a votos, a AD (34,4%) deixaria o PS (27,8%) a quase sete pontos de distância, com os homens a serem decisivos na vantagem da coligação de centro-direita sobre os socialistas. De acordo com a mais recente sondagem da Pitagórica para o JN, TSF e TVI/CNN, o Chega (14,9%) é o partido que mais perde com a antecipação eleitoral. Mais abaixo seguem a Iniciativa Liberal (6%) e o Livre (5,5%), a força política que mais beneficiou com a crise do último mês, ultrapassando a CDU (3,4%) e o BE (2,7%). O PAN (0,5%) ficaria de fora do Parlamento.
Tendo em conta que a margem de erro da sondagem é de mais ou menos 3,16%, a liderança da AD aparenta solidez. O seu patamar mínimo (31,4%) é agora superior ao máximo a que o PS poderia aspirar nesta altura (30,6%). A coligação liderada por Luís Montenegro é a força política que mais cresce relativamente às eleições do ano passado (5,6 pontos percentuais) econquista um pontoentre as sondagens do início e do final de março, o que sugere que ocaso Spinumviva, que levou à queda do Governo, já não tem o potencial para causar estragos eleitorais.
No entanto, é importante notar que uma sondagem é o retrato de um momento que já passou, ainda que recente (o trabalho de campo decorreu durante toda a semana passada), e que, quando falta mês e meio para as legislativas é impossível prever o resultado. Acresce que o número de indecisos (18,6%) seria só por si suficiente para baralhar as contas. Com alguns segmentos a destacarem-se na hesitação relativamente a quem votar: os que têm 45 a 54 anos (23% de indecisos) e 18 a 24 anos (21%) e os que vivem em Lisboa e no Norte (20%).
A outra da face da moeda, relativamente à AD, é que, com estes resultados, e apesar do crescimento, um futuro Governo voltará a ser minoritário. Mesmo que Luís Montenegro conseguisse negociar com os liberais (6%) um acordo pós-eleitoral, os números são curtos: 40 pontos são insuficientes para obter uma maioria absoluta na Assembleia da República. Recorde-se que a última vez que dois partidos de centro-direita (PSD e CDS) conseguiram esse tipo de controlo parlamentar, concorrendo em listas separadas, foi em 2011, somando 50% dos votos e 132 deputados.
À Direita, o fiel da balança continuaria a ser o Chega, que está em terceiro lugar (14,9%). Apesar de ter recuperado um ponto entre asondagem do início de marçoe a atual, o partido da direita radical populista (designação da ciência política) continua a ser o que mais perde, se a comparação se fizer com as últimas legislativas (mais de três pontos). Com André Ventura afastado do arco do poder, graças ao “não é não” de Luís Montenegro, a enorme vantagem do bloco à Direita (56 pontos, mais quatro do que nas últimas legislativas) sobre o da Esquerda (40 pontos, menos um do que em 2024) não reverte em estabilidade.
A vantagem da AD não se faz à custa do PS, que parece um relógio suíço, tal a estabilidade dos resultados emsucessivos estudos de opinião da Pitagórica. Ainda que os socialistas tenham perdido um ponto, relativamente à sondagem do início de março, a verdade é que estão no mesmo patamar das últimas legislativas, a rondar os 28%. Um relógio suíço... parado. Os eleitores não agravam o castigo sofrido em 2024 (o PS perdeu a maioria absoluta), mas também não parecem mobilizados para fazer de Pedro Nuno Santos primeiro-ministro. Acresce outra dificuldade: os socialistas não têm, à Esquerda, parceiros com a força suficiente para montar uma geringonça.
Mesmo que um das grandes surpresas desta sondagem seja o Livre (5,5%), o partido que mais cresce em tempos de crise política (quase três pontos do início para o final de março). Se tivermos em conta a margem de erro (mais ou menos 3,16%), poderia até superar a Iniciativa Liberal: o patamar máximo do partido de Rui Tavares (6,9%) fica acima do mínimo atribuído à IL de Rui Rocha (4,5%). Esta moeda tem, no entanto, duas faces: o mínimo para o Livre é de 4,1% e o máximo para os liberais é de 7,5%, caso em que a proximidade já não seria assim tão evidente.
Seja como for, o Livre supera, nesta altura, partidos de Esquerda com mais anos de história: CDU (3,4%), com um resultado muito semelhante ao das últimas legislativas, e Bloco de Esquerda (2,7%), que é, depois do Chega, o segundo partido que mais perde com esta crise (quase dois pontos face a março de 2024). As próximas semanas dirão se a aposta em nomes históricos como Francisco Louçã, Fernando Rosas e Luís Fazenda conseguirá reverter a sangria.
A análise aos diferentes segmentos de eleitores (género, idade, classe social e região) permite perceber melhor as diferenças entre os vários partidos. E desta vez, também é aí que se encontra a explicação para o duplo movimento de subida (da AD) e descida (do PS) ao longo do mês de março. Concretamente no género: foi entre os homens que se acentuou a vantagem da coligação de centro-direita sobre os socialistas (de dois para nove pontos), uma vez que, entre as mulheres, a diferença se reduziu de seis para dois pontos (de novo com a AD à frente).
Acrescente-se, no entanto, que PSD/CDS atingiram um equilíbrio perfeito, com uns redondos 28% neles e nelas (nos segmentos, os valores são apresentados sem distribuição de indecisos). Já no PS acentua-se a importância do eleitorado feminino (mais sete pontos do que entre os homens).
O poder de atração masculino que falta aos socialistas (apenas 18,9%), sobra ao Chega (17%), que mantém a dificuldade em atrair as mulheres (7,8%). Ainda no que ao género diz respeito, destaca-se o equilíbrio da Iniciativa Liberal, enquanto o Livre e a CDU se mostram mais femininos (pouco habitual nos comunistas).
Carregue nos ícones para ver as percentagens
Quando o foco de análise incide sobre a idade do eleitor, percebe-se que é nos 25/34 e 35/44 anos que a vantagem da AD sobre o PS é maior (doze pontos). Mas talvez o mais notável talvez seja o facto de, nesta sondagem, a coligação liderada por Luís Montenegro também estar à frente entre os pensionistas (65 ou mais anos) e logo por quatro pontos (34%).
Este é o grupo mais numeroso das seis faixas etárias em que se divide a amostra e aquele que, durante a última década, se revelou o principal bastião socialista. O PS continua a ter o seu melhor resultado (29,9%) entre os mais velhos e está em primeiro entre os mais jovens (18/24 anos), com 20,2%. Nos 55/64 anos empata com a AD (26,4%).
O Chega consegue o seu melhor resultado, ao ponto de arrancar um segundo lugar, na faixa dos 35/44 anos (18,7%). É também nesta geração que a IL atinge a sua melhor pontuação (11%). A Direita radical e os liberais partilham outro traço: maior debilidade entre os eleitores mais velhos. Nota ainda para o Livre que, entre os mais jovens (18/24 anos) consegue o quarto lugar (8,1%), à frente da IL (5,6%).
Carregue nos ícones para ver as percentagens
Também no que diz respeito à geografia, a AD mostra a sua força, liderando nas quatro regiões em que se divide a amostra, com destaque para o Centro (31%, mais nove pontos do que o PS), que substitui o Norte (29,7%, mais oito do que os socialistas) como principal bastião do centro-direita. O terreno mais difícil para Luís Montenegro continua a ser a região de Lisboa (22,4%), ainda que tenha conseguido roubar a liderança a Pedro Nuno Santos. Para este último, o melhor resultado é agora no Sul e Ilhas (27,5%), mas é na capital que mais se aproxima do principal rival (20,6%).
O Chega de André Ventura consegue o terceiro lugar em todo o país, volta a ter o melhor resultado a Sul (que inclui o Algarve, região em que ficou em primeiro lugar, nas últimas legislativas) e o pior a Norte (11,1%). Os liberais têm o melhor resultado em Lisboa (6,4%), mas ficam atrás do Livre (8,2%). É também na região da capital, que inclui a margem sul e Setúbal, que os comunistas têm o seu melhor resultado (5%), duplicando o resultado do BE (2,5%).
Acresce que a região de Lisboa é a mais acolhedora para o bloco de partidos à Esquerda. É ainda o bloco à Direita (41 pontos) que lidera, mas com uma vantagem de “apenas” quatro pontos sobre a Esquerda (37 pontos). Nas regiões Centro e Norte, o fosso alarga-se para 18 pontos, com vantagem para a Direita.

Sondagem realizada pela Pitagórica para a TVI, CNN Portugal, TSF e JN, com o objetivo de avaliar a opinião dos portugueses sobre temas relacionados com a atualidade do país. O trabalho de campo decorreu entre os dias 24 e 29 de março de 2025. A amostra foi recolhida de forma aleatória junto de eleitores portugueses recenseados e foi devidamente estratificada por género, idade e região. Foram realizadas 1626 tentativas de contacto, para alcançarmos 1000 entrevistas efetivas, pelo que a taxa de resposta foi de 61,50%. As 1000 entrevistas telefónicas recolhidas correspondem a uma margem de erro máxima de +/- 3,16% para um nível de confiança de 95,5%. A direção técnica do estudo é da responsabilidade de Rita Marques da Silva. A ficha técnica completa, bem como todos os resultados, foram depositados junto da ERC - Entidade Reguladora da Comunicação Social, que os disponibilizará para consulta online.","<div class=""date""><span>31 março, 2025</span></div>"
"Montenegro diz que é tempo de ""olhar para o futuro com esperança""",https://www.jn.pt/6947033525/montenegro-diz-que-e-tempo-de-olhar-para-o-futuro-com-esperanca/,Vila do Conde,"O primeiro-ministro, Luís Montenegro, considerou esta segunda-feira ser tempo de olhar o futuro com confiança, sublinhando o foco do Governo na construção de um país mais equilibrado, mais próspero e mais justo.
“Não é tempo de baixar os braços, é tempo de olhar para o futuro com esperança”, defendeu o líder do executivo, em Vila do Conde, distrito do Porto, durante a inauguração de uma infraestrutura científica integrada no projeto Biopolis liderado pela Universidade do Porto.
Montenegro destacou o “bom contexto económico interno” e o “muitíssimo bom contexto financeiro” de Portugal, para salientar que “o tempo é de esperança”.
O primeiro-ministro garantiu que o Governo não está de braços caídos, mas sim “muito empenhado e muito ciente” da sua responsabilidade de não desperdiçar a oportunidade para transformar o país.
O Governo está focado “em realizar”, em vez de “fazer grandes números de folclore político”, frisou.
Para Montenegro, o verdadeiro debate deveria ser sobre os relatórios de execução dos orçamentos do Estado, em vez de “endeusar os debates” quando aqueles documentos são apresentados. “Aquilo é apenas uma estimativa”, afirmou.
A propósito, aludiu à ”maior taxa de execução de sempre”, em 2024, dos fundos alocados à ciência, num total de 833 milhões de euros.
Na sua intervenção, o primeiro-ministro destacou que Portugal “é hoje um dos países com melhor situação económica na Europa” e está a viver um contexto financeiro “muitíssimo bom”.
“Creio que seremos mesmoo país mais equilibrado da União Europeia”, apontou.
Montenegro lembrou também a “boa” taxa de crescimento económico, o excedente orçamental, uma trajetória de diminuição da dívida pública “muito sustentada”, uma dívida externa abaixo de 60 por cento e “um pais que se pode dar ao luxo de endividar no mercado a taxas de juro iguais às das grandes potências económicas”.
“Um país que está muitíssimo bem. Mas isto não é para contemplar, isto é para preservar e desenvolver”, concluiu.","<div class=""date""> 24 março, 2025 às 13:30 </div>"
